<?xml version="1.0" encoding="UTF-8"?>
<!DOCTYPE world SYSTEM "world.dtd">
<world version="1">
 <level name="Optimize">
  <linked-edges>
   <edge-set id="Optimize1">
    <edgeref id="e11"/>
	<edgeref id="e12"/>
   </edge-set>
   <edge-set id="Optimize2">
    <edgeref id="e21"/>
	<edgeref id="e22"/>
	<edgeref id="e23"/>
	<edgeref id="e24"/>
   </edge-set>
   <edge-set id="Optimize3">
    <edgeref id="e31"/>
	<edgeref id="e32"/>
	<edgeref id="e33"/>
	<edgeref id="e34"/>
	<edgeref id="e35"/>
   </edge-set>
   <edge-set id="Optimize4">
    <edgeref id="e41"/>
	<edgeref id="e42"/>
   </edge-set>
  </linked-edges>
  <boards>
   <board name="Optimize--Board">
    <node kind="INCOMING" id="n11">
     <input/>
     <output>
      <port num="0" edge="e11"/>
	  <port num="1" edge="e21"/>
	  <port num="2" edge="e31"/>
	  <port num="3" edge="e32"/>
	  <port num="4" edge="e41"/>
     </output>
     <layout>
      <x>0.0</x>
      <y>0.0</y>
     </layout>
    </node>
	<node kind="START_PIPE_DEPENDENT_BALL" id="n12">
     <input/>
     <output>
      <port num="0" edge="e12"/>
     </output>
     <layout><x>0.0</x><y>0.0</y></layout>
    </node>
	<node kind="START_PIPE_DEPENDENT_BALL" id="n23">
     <input/>
     <output>
      <port num="0" edge="e23"/>
     </output>
     <layout><x>0.0</x><y>0.0</y></layout>
    </node>
	<node kind="START_PIPE_DEPENDENT_BALL" id="n34">
     <input/>
     <output>
      <port num="0" edge="e34"/>
     </output>
     <layout><x>0.0</x><y>0.0</y></layout>
    </node>
	<node kind="START_PIPE_DEPENDENT_BALL" id="n42">
     <input/>
     <output>
      <port num="0" edge="e42"/>
     </output>
     <layout><x>0.0</x><y>0.0</y></layout>
    </node>
	<node kind="CONNECT" id="n22">
     <input>
	  <port num="0" edge="e12"/>
	 </input>
     <output>
      <port num="0" edge="e22"/>
     </output>
     <layout><x>0.0</x><y>0.0</y></layout>
    </node>
	<node kind="CONNECT" id="n24">
     <input>
	  <port num="0" edge="e34"/>
	 </input>
     <output>
      <port num="0" edge="e24"/>
     </output>
     <layout><x>0.0</x><y>0.0</y></layout>
    </node>
	<node kind="CONNECT" id="n33">
     <input>
	  <port num="0" edge="e23"/>
	 </input>
     <output>
      <port num="0" edge="e33"/>
     </output>
     <layout><x>0.0</x><y>0.0</y></layout>
    </node>
	<node kind="CONNECT" id="n35">
     <input>
	  <port num="0" edge="e42"/>
	 </input>
     <output>
      <port num="0" edge="e35"/>
     </output>
     <layout><x>0.0</x><y>0.0</y></layout>
    </node>
	<node kind="END" id="n110">
     <input>
      <port num="0" edge="e11"/>
     </input>
     <output/>
     <layout><x>0.0</x><y>0.0</y></layout>
    </node>
	<node kind="END" id="n210">
     <input>
      <port num="0" edge="e21"/>
     </input>
     <output/>
     <layout><x>0.0</x><y>0.0</y></layout>
    </node>
	<node kind="END" id="n220">
     <input>
      <port num="0" edge="e22"/>
     </input>
     <output/>
     <layout><x>0.0</x><y>0.0</y></layout>
    </node>
	<node kind="END" id="n240">
     <input>
      <port num="0" edge="e24"/>
     </input>
     <output/>
     <layout><x>0.0</x><y>0.0</y></layout>
    </node>
	<node kind="END" id="n310">
     <input>
      <port num="0" edge="e31"/>
     </input>
     <output/>
     <layout><x>0.0</x><y>0.0</y></layout>
    </node>
	<node kind="END" id="n320">
     <input>
      <port num="0" edge="e32"/>
     </input>
     <output/>
     <layout><x>0.0</x><y>0.0</y></layout>
    </node>
	<node kind="END" id="n330">
     <input>
      <port num="0" edge="e33"/>
     </input>
     <output/>
     <layout><x>0.0</x><y>0.0</y></layout>
    </node>
	<node kind="END" id="n350">
     <input>
      <port num="0" edge="e35"/>
     </input>
     <output/>
     <layout><x>0.0</x><y>0.0</y></layout>
    </node>
	<node kind="END" id="n410">
     <input>
      <port num="0" edge="e41"/>
     </input>
     <output/>
     <layout><x>0.0</x><y>0.0</y></layout>
    </node>
    <edge description="this" variableID="-1" pinch="false" width="narrow" editable="true" id="e11" buzzsaw="false">
     <from>
      <noderef id="n11" port="0"/>
     </from>
     <to>
      <noderef id="n110" port="0"/>
     </to>
     <edge-layout><point><x>0</x><y>0</y></point><point><x>0</x><y>0</y></point><point><x>0</x><y>0</y></point><point><x>0</x><y>0</y></point></edge-layout>
    </edge>
	<edge description="this" variableID="-1" pinch="false" width="narrow" editable="true" id="e12" buzzsaw="false">
     <from>
      <noderef id="n12" port="0"/>
     </from>
     <to>
      <noderef id="n22" port="0"/>
     </to>
     <edge-layout><point><x>0</x><y>0</y></point><point><x>0</x><y>0</y></point><point><x>0</x><y>0</y></point><point><x>0</x><y>0</y></point></edge-layout>
    </edge>
	<edge description="this" variableID="-1" pinch="false" width="narrow" editable="true" id="e21" buzzsaw="false">
     <from>
      <noderef id="n11" port="1"/>
     </from>
     <to>
      <noderef id="n210" port="0"/>
     </to>
     <edge-layout><point><x>0</x><y>0</y></point><point><x>0</x><y>0</y></point><point><x>0</x><y>0</y></point><point><x>0</x><y>0</y></point></edge-layout>
    </edge>
	<edge description="this" variableID="-1" pinch="false" width="narrow" editable="true" id="e22" buzzsaw="false">
     <from>
      <noderef id="n22" port="0"/>
     </from>
     <to>
      <noderef id="n220" port="0"/>
     </to>
     <edge-layout><point><x>0</x><y>0</y></point><point><x>0</x><y>0</y></point><point><x>0</x><y>0</y></point><point><x>0</x><y>0</y></point></edge-layout>
    </edge>
	<edge description="this" variableID="-1" pinch="false" width="narrow" editable="true" id="e23" buzzsaw="false">
     <from>
      <noderef id="n23" port="0"/>
     </from>
     <to>
      <noderef id="n33" port="0"/>
     </to>
     <edge-layout><point><x>0</x><y>0</y></point><point><x>0</x><y>0</y></point><point><x>0</x><y>0</y></point><point><x>0</x><y>0</y></point></edge-layout>
    </edge>
	<edge description="this" variableID="-1" pinch="false" width="narrow" editable="true" id="e24" buzzsaw="false">
     <from>
      <noderef id="n24" port="0"/>
     </from>
     <to>
      <noderef id="n240" port="0"/>
     </to>
     <edge-layout><point><x>0</x><y>0</y></point><point><x>0</x><y>0</y></point><point><x>0</x><y>0</y></point><point><x>0</x><y>0</y></point></edge-layout>
    </edge>
	<edge description="this" variableID="-1" pinch="false" width="narrow" editable="true" id="e31" buzzsaw="false">
     <from>
      <noderef id="n11" port="2"/>
     </from>
     <to>
      <noderef id="n310" port="0"/>
     </to>
     <edge-layout><point><x>0</x><y>0</y></point><point><x>0</x><y>0</y></point><point><x>0</x><y>0</y></point><point><x>0</x><y>0</y></point></edge-layout>
    </edge>
	<edge description="this" variableID="-1" pinch="false" width="narrow" editable="true" id="e32" buzzsaw="false">
     <from>
      <noderef id="n11" port="3"/>
     </from>
     <to>
      <noderef id="n320" port="0"/>
     </to>
     <edge-layout><point><x>0</x><y>0</y></point><point><x>0</x><y>0</y></point><point><x>0</x><y>0</y></point><point><x>0</x><y>0</y></point></edge-layout>
    </edge>
	<edge description="this" variableID="-1" pinch="true" width="narrow" editable="true" id="e33" buzzsaw="false">
     <from>
      <noderef id="n33" port="0"/>
     </from>
     <to>
      <noderef id="n330" port="0"/>
     </to>
     <edge-layout><point><x>0</x><y>0</y></point><point><x>0</x><y>0</y></point><point><x>0</x><y>0</y></point><point><x>0</x><y>0</y></point></edge-layout>
    </edge>
	<edge description="this" variableID="-1" pinch="false" width="narrow" editable="true" id="e34" buzzsaw="false">
     <from>
      <noderef id="n34" port="0"/>
     </from>
     <to>
      <noderef id="n24" port="0"/>
     </to>
     <edge-layout><point><x>0</x><y>0</y></point><point><x>0</x><y>0</y></point><point><x>0</x><y>0</y></point><point><x>0</x><y>0</y></point></edge-layout>
    </edge>
	<edge description="this" variableID="-1" pinch="true" width="narrow" editable="true" id="e35" buzzsaw="false">
     <from>
      <noderef id="n35" port="0"/>
     </from>
     <to>
      <noderef id="n350" port="0"/>
     </to>
     <edge-layout><point><x>0</x><y>0</y></point><point><x>0</x><y>0</y></point><point><x>0</x><y>0</y></point><point><x>0</x><y>0</y></point></edge-layout>
    </edge>
	<edge description="this" variableID="-1" pinch="false" width="narrow" editable="true" id="e41" buzzsaw="false">
     <from>
      <noderef id="n11" port="4"/>
     </from>
     <to>
      <noderef id="n410" port="0"/>
     </to>
     <edge-layout><point><x>0</x><y>0</y></point><point><x>0</x><y>0</y></point><point><x>0</x><y>0</y></point><point><x>0</x><y>0</y></point></edge-layout>
    </edge>
	<edge description="this" variableID="-1" pinch="false" width="narrow" editable="true" id="e42" buzzsaw="false">
     <from>
      <noderef id="n42" port="0"/>
     </from>
     <to>
      <noderef id="n35" port="0"/>
     </to>
     <edge-layout><point><x>0</x><y>0</y></point><point><x>0</x><y>0</y></point><point><x>0</x><y>0</y></point><point><x>0</x><y>0</y></point></edge-layout>
    </edge>
   </board>
  </boards>
 </level>
</world>
