<?xml version="1.0" encoding="UTF-8"?>
<!DOCTYPE world SYSTEM "world.dtd">
<world version="1">
 <level name="Layout" qid="12">
  <linked-edges>
   <edge-set id="Layout1">
    <edgeref id="e1"/>
   </edge-set>
   <edge-set id="Layout2">
    <edgeref id="e2"/>
   </edge-set>
   <edge-set id="Layout3">
    <edgeref id="e3"/>
   </edge-set>
   <edge-set id="Layout4">
    <edgeref id="e4"/>
   </edge-set>
   <edge-set id="Layout5">
    <edgeref id="e5"/>
   </edge-set>
  </linked-edges>
  <boards>
   <board name="Layout--Board">
    <node kind="INCOMING" id="n1">
     <input/>
     <output><port num="0" edge="e1"/></output>
     <layout><x>0.0</x><y>0.0</y></layout>
    </node>
	<node kind="START_PIPE_DEPENDENT_BALL" id="n2">
     <input/>
     <output><port num="0" edge="e2"/></output>
     <layout><x>0.0</x><y>0.0</y></layout>
    </node>
	<node kind="START_PIPE_DEPENDENT_BALL" id="n3">
     <input/>
     <output><port num="0" edge="e3"/></output>
     <layout><x>0.0</x><y>0.0</y></layout>
    </node>
	<node kind="START_PIPE_DEPENDENT_BALL" id="n4">
     <input/>
     <output><port num="0" edge="e4"/></output>
     <layout><x>0.0</x><y>0.0</y></layout>
    </node>
	<node kind="START_PIPE_DEPENDENT_BALL" id="n5">
     <input/>
     <output><port num="0" edge="e5"/></output>
     <layout><x>0.0</x><y>0.0</y></layout>
    </node>
	<node kind="END" id="n10">
     <input><port num="0" edge="e1"/></input>
     <output/>
     <layout><x>0.0</x><y>0.0</y></layout>
    </node>
	<node kind="END" id="n20">
     <input><port num="0" edge="e2"/></input>
     <output/>
     <layout><x>0.0</x><y>0.0</y></layout>
    </node>
	<node kind="END" id="n30">
     <input><port num="0" edge="e3"/></input>
     <output/>
     <layout><x>0.0</x><y>0.0</y></layout>
    </node>
	<node kind="OUTGOING" id="n40">
     <input><port num="0" edge="e4"/></input>
     <output/>
     <layout><x>0.0</x><y>0.0</y></layout>
    </node>
	<node kind="END" id="n50">
     <input><port num="0" edge="e5"/></input>
     <output/>
     <layout><x>0.0</x><y>0.0</y></layout>
    </node>
    <edge description="this" variableID="-1" pinch="false" width="narrow" editable="true" id="e1" buzzsaw="false">
     <from><noderef id="n1" port="0"/></from>
     <to><noderef id="n10" port="0"/></to>
     <edge-layout><point><x>0</x><y>0</y></point><point><x>0</x><y>0</y></point><point><x>0</x><y>0</y></point><point><x>0</x><y>0</y></point></edge-layout>
    </edge>
	<edge description="this" variableID="-1" pinch="false" width="narrow" editable="false" id="e2" buzzsaw="false">
     <from><noderef id="n2" port="0"/></from>
     <to><noderef id="n20" port="0"/></to>
     <edge-layout><point><x>0</x><y>0</y></point><point><x>0</x><y>0</y></point><point><x>0</x><y>0</y></point><point><x>0</x><y>0</y></point></edge-layout>
    </edge>
	<edge description="this" variableID="-1" pinch="false" width="narrow" editable="false" id="e3" buzzsaw="false">
     <from><noderef id="n3" port="0"/></from>
     <to><noderef id="n30" port="0"/></to>
     <edge-layout><point><x>0</x><y>0</y></point><point><x>0</x><y>0</y></point><point><x>0</x><y>0</y></point><point><x>0</x><y>0</y></point></edge-layout>
    </edge>
	<edge description="this" variableID="-1" pinch="false" width="wide" editable="true" id="e4" buzzsaw="false">
     <from><noderef id="n4" port="0"/></from>
     <to><noderef id="n40" port="0"/></to>
     <edge-layout><point><x>0</x><y>0</y></point><point><x>0</x><y>0</y></point><point><x>0</x><y>0</y></point><point><x>0</x><y>0</y></point></edge-layout>
    </edge>
	<edge description="this" variableID="-1" pinch="false" width="wide" editable="false" id="e5" buzzsaw="false">
     <from><noderef id="n5" port="0"/></from>
     <to><noderef id="n50" port="0"/></to>
     <edge-layout><point><x>0</x><y>0</y></point><point><x>0</x><y>0</y></point><point><x>0</x><y>0</y></point><point><x>0</x><y>0</y></point></edge-layout>
    </edge>
   </board>
  </boards>
 </level>
</world>
