<?xml version="1.0" encoding="UTF-8"?>
<!DOCTYPE world SYSTEM "world.dtd">
<world version="1">
 <level name="Merges">
  <linked-edges>
   <edge-set id="Merges1">
    <edgeref id="e1"/>
   </edge-set>
   <edge-set id="Merges2">
    <edgeref id="e2"/>
   </edge-set>
   <edge-set id="Merges3">
    <edgeref id="e3"/>
   </edge-set>
  </linked-edges>
  <boards>
   <board name="Merges--Board">
    <node kind="START_PIPE_DEPENDENT_BALL" id="n1">
     <input/>
     <output><port num="0" edge="e1"/></output>
     <layout><x>0</x><y>0</y></layout>
    </node>
	<node kind="START_PIPE_DEPENDENT_BALL" id="n2">
     <input/>
     <output><port num="0" edge="e2"/></output>
     <layout><x>0</x><y>0</y></layout>
    </node>
    <node id="n123" kind="MERGE">
     <input>
      <port edge="e1" num="left"/>
      <port edge="e2" num="right"/>
     </input>
     <output><port edge="e3" num="output"/></output>
     <layout><x>0</x><y>0</y></layout>
    </node>
	<node kind="END" id="n3">
     <input><port num="0" edge="e3"/></input>
     <output/>
     <layout><x>0</x><y>0</y></layout>
    </node>
    <edge description="this" variableID="-1" pinch="false" width="wide" editable="true" id="e1" buzzsaw="false">
     <from><noderef id="n1" port="0"/></from>
     <to><noderef id="n123" port="left"/></to>
     <edge-layout><point><x>0</x><y>0</y></point><point><x>0</x><y>0</y></point><point><x>0</x><y>0</y></point><point><x>0</x><y>0</y></point></edge-layout>
    </edge>
	<edge description="this" variableID="-1" pinch="false" width="wide" editable="true" id="e2" buzzsaw="false">
     <from><noderef id="n2" port="0"/></from>
     <to><noderef id="n123" port="right"/></to>
     <edge-layout><point><x>0</x><y>0</y></point><point><x>0</x><y>0</y></point><point><x>0</x><y>0</y></point><point><x>0</x><y>0</y></point></edge-layout>
    </edge>
	<edge description="this" variableID="-1" pinch="false" width="narrow" editable="false" id="e3" buzzsaw="false">
     <from><noderef id="n123" port="output"/></from>
     <to><noderef id="n3" port="0"/></to>
     <edge-layout><point><x>0</x><y>0</y></point><point><x>0</x><y>0</y></point><point><x>0</x><y>0</y></point><point><x>0</x><y>0</y></point></edge-layout>
    </edge>
   </board>
  </boards>
 </level>
</world>
