<?xml version="1.0" encoding="UTF-8"?>
<!DOCTYPE world SYSTEM "world.dtd">
<world version="1">
 <level name="Splits" qid="10">
  <linked-edges>
   <edge-set id="Splits1">
    <edgeref id="e1"/>
   </edge-set>
   <edge-set id="Splits2">
    <edgeref id="e2"/>
   </edge-set>
   <edge-set id="Splits3">
    <edgeref id="e3"/>
   </edge-set>
   <edge-set id="Splits4">
    <edgeref id="e4"/>
   </edge-set>
   <edge-set id="Splits5">
    <edgeref id="e5"/>
   </edge-set>
   <edge-set id="Splits6">
    <edgeref id="e6"/>
   </edge-set>
  </linked-edges>
  <boards>
    <board name="Splits--Sub">
    <node kind="START_PIPE_DEPENDENT_BALL" id="n1">
     <input/>
     <output><port num="0" edge="e1"/></output>
     <layout><x>0</x><y>0</y></layout>
    </node>
	<node kind="OUTGOING" id="n10">
     <input><port num="0" edge="e1"/></input>
     <output/>
     <layout><x>0</x><y>0</y></layout>
    </node>
    <edge description="this" variableID="-1" pinch="false" width="wide" editable="true" id="e1" buzzsaw="false">
     <from><noderef id="n1" port="0"/></from>
     <to><noderef id="n10" port="0"/></to>
     <edge-layout><point><x>0</x><y>0</y></point><point><x>0</x><y>0</y></point><point><x>0</x><y>0</y></point><point><x>0</x><y>0</y></point></edge-layout>
    </edge>
   </board>
   <board name="Splits--Board">
    <node id="n2" kind="SUBBOARD" name="Splits--Sub">
     <input/>
     <output>
      <port edge="e2" num="0"/>
     </output>
     <layout><x>0</x><y>0</y>
     </layout>
    </node>
	<node id="n3" kind="SUBBOARD" name="Splits--Sub">
     <input/>
     <output>
      <port edge="e3" num="0"/>
     </output>
     <layout><x>0</x><y>0</y>
     </layout>
    </node>
	<node id="n4" kind="SUBBOARD" name="Splits--Sub">
     <input/>
     <output>
      <port edge="e4" num="0"/>
     </output>
     <layout><x>0</x><y>0</y>
     </layout>
    </node>
	<node id="n40" kind="SPLIT">
     <input><port edge="e4" num="input"/></input>
     <output>
      <port edge="e5" num="output"/>
      <port edge="e6" num="split"/>
     </output>
     <layout><x>0</x><y>0</y></layout>
    </node>
	<node kind="END" id="n20">
     <input><port num="0" edge="e2"/></input>
     <output/>
     <layout><x>0</x><y>0</y></layout>
    </node>
	<node kind="END" id="n30">
     <input><port num="0" edge="e3"/></input>
     <output/>
     <layout><x>0</x><y>0</y></layout>
    </node>
	<node kind="END" id="n50">
     <input><port num="0" edge="e5"/></input>
     <output/>
     <layout><x>0</x><y>0</y></layout>
    </node>
	<node kind="END" id="n60">
     <input><port num="0" edge="e6"/></input>
     <output/>
     <layout><x>0</x><y>0</y></layout>
    </node>
    <edge description="this" variableID="-1" pinch="false" width="narrow" editable="false" id="e2" buzzsaw="false">
     <from><noderef id="n2" port="0"/></from>
     <to><noderef id="n20" port="0"/></to>
     <edge-layout><point><x>0</x><y>0</y></point><point><x>0</x><y>0</y></point><point><x>0</x><y>0</y></point><point><x>0</x><y>0</y></point></edge-layout>
    </edge>
	<edge description="this" variableID="-1" pinch="false" width="wide" editable="false" id="e3" buzzsaw="false">
     <from><noderef id="n3" port="0"/></from>
     <to><noderef id="n30" port="0"/></to>
     <edge-layout><point><x>0</x><y>0</y></point><point><x>0</x><y>0</y></point><point><x>0</x><y>0</y></point><point><x>0</x><y>0</y></point></edge-layout>
    </edge>
	<edge description="this" variableID="-1" pinch="false" width="narrow" editable="true" id="e4" buzzsaw="false">
     <from><noderef id="n4" port="0"/></from>
     <to><noderef id="n40" port="input"/></to>
     <edge-layout><point><x>0</x><y>0</y></point><point><x>0</x><y>0</y></point><point><x>0</x><y>0</y></point><point><x>0</x><y>0</y></point></edge-layout>
    </edge>
	<edge description="this" variableID="-1" pinch="false" width="wide" editable="false" id="e5" buzzsaw="false">
     <from><noderef id="n40" port="output"/></from>
     <to><noderef id="n50" port="0"/></to>
     <edge-layout><point><x>0</x><y>0</y></point><point><x>0</x><y>0</y></point><point><x>0</x><y>0</y></point><point><x>0</x><y>0</y></point></edge-layout>
    </edge>
	<edge description="this" variableID="-1" pinch="false" width="narrow" editable="false" id="e6" buzzsaw="false">
     <from><noderef id="n40" port="split"/></from>
     <to><noderef id="n60" port="0"/></to>
     <edge-layout><point><x>0</x><y>0</y></point><point><x>0</x><y>0</y></point><point><x>0</x><y>0</y></point><point><x>0</x><y>0</y></point></edge-layout>
    </edge>
   </board>
  </boards>
 </level>
</world>
