<?xml version="1.0" encoding="UTF-8"?>
<!DOCTYPE world SYSTEM "world.dtd">
<world version="1">
 <level name="Jams" qid="6">
  <linked-edges>
   <edge-set id="Clashes1">
    <edgeref id="e1"/>
   </edge-set>
   <edge-set id="Clashes2">
    <edgeref id="e2"/>
   </edge-set>
  </linked-edges>
  <boards>
   <board name="Clashes--Board">
    <node kind="START_PIPE_DEPENDENT_BALL" id="n1">
     <input/>
     <output>
      <port num="0" edge="e1"/>
     </output>
     <layout>
      <x>0.0</x>
      <y>0.0</y>
     </layout>
    </node>
	<node kind="CONNECT" id="n12">
     <input><port num="0" edge="e1"/></input>
     <output><port num="0" edge="e2"/></output>
     <layout><x>0.0</x><y>0.0</y></layout>
    </node>
	<node kind="END" id="n2">
     <input>
      <port num="0" edge="e2"/>
     </input>
     <output/>
     <layout><x>0.0</x><y>0.0</y></layout>
    </node>
    <edge description="this" variableID="-1" pinch="false" width="wide" editable="true" id="e1" buzzsaw="false">
     <from><noderef id="n1" port="0"/></from>
     <to><noderef id="n12" port="0"/></to>
     <edge-layout><point><x>0</x><y>0</y></point><point><x>0</x><y>0</y></point><point><x>0</x><y>0</y></point><point><x>0</x><y>0</y></point></edge-layout>
    </edge>
	<edge description="this" variableID="-1" pinch="false" width="narrow" editable="false" id="e2" buzzsaw="false">
     <from><noderef id="n12" port="0"/></from>
     <to><noderef id="n2" port="0"/></to>
     <edge-layout><point><x>0</x><y>0</y></point><point><x>0</x><y>0</y></point><point><x>0</x><y>0</y></point><point><x>0</x><y>0</y></point></edge-layout>
    </edge>
   </board>
  </boards>
 </level>
</world>
