<?xml version="1.0" encoding="UTF-8"?>
<!DOCTYPE world SYSTEM "world.dtd">
<world version="1">
 <level name="Links" qid="4">
  <linked-edges>
   <edge-set id="SatisfyBoxes1">
    <edgeref id="e1"/>
   </edge-set>
   <edge-set id="SatisfyBoxes2">
    <edgeref id="e2"/>
   </edge-set>
   <edge-set id="SatisfyBoxes3">
    <edgeref id="e3"/>
    <edgeref id="e4"/>
   </edge-set>
   <edge-set id="SatisfyBoxes10">
    <edgeref id="e10"/>
   </edge-set>
   <edge-set id="SatisfyBoxes20">
    <edgeref id="e20"/>
   </edge-set>
   <edge-set id="SatisfyBoxes30">
    <edgeref id="e30"/>
   </edge-set>
   <edge-set id="SatisfyBoxes40">
    <edgeref id="e40"/>
   </edge-set>
  </linked-edges>
  <boards>
   <board name="SatisfyBoxes--Board">
    <node kind="INCOMING" id="n1">
     <input/>
     <output>
      <port num="0" edge="e1"/>
	  <port num="1" edge="e3"/>
	  <port num="2" edge="e4"/>
     </output>
     <layout>
      <x>0.0</x>
      <y>0.0</y>
     </layout>
    </node>
	<node kind="START_SMALL_BALL" id="n2">
     <input/>
     <output>
      <port num="0" edge="e2"/>
     </output>
     <layout><x>0.0</x><y>0.0</y></layout>
    </node>
	<node kind="CONNECT" id="n10">
     <input>
	  <port num="0" edge="e1"/>
	 </input>
     <output>
      <port num="0" edge="e10"/>
     </output>
     <layout><x>0.0</x><y>0.0</y></layout>
    </node>
	<node kind="CONNECT" id="n20">
     <input>
	  <port num="0" edge="e2"/>
	 </input>
     <output>
      <port num="0" edge="e20"/>
     </output>
     <layout><x>0.0</x><y>0.0</y></layout>
    </node>
	<node kind="CONNECT" id="n30">
     <input>
	  <port num="0" edge="e3"/>
	 </input>
     <output>
      <port num="0" edge="e30"/>
     </output>
     <layout><x>0.0</x><y>0.0</y></layout>
    </node>
	<node kind="CONNECT" id="n40">
     <input>
	  <port num="0" edge="e4"/>
	 </input>
     <output>
      <port num="0" edge="e40"/>
     </output>
     <layout><x>0.0</x><y>0.0</y></layout>
    </node>
	<node kind="END" id="n100">
     <input>
      <port num="0" edge="e10"/>
     </input>
     <output/>
     <layout><x>0.0</x><y>0.0</y></layout>
    </node>
	<node kind="OUTGOING" id="n200">
     <input>
      <port num="0" edge="e20"/>
     </input>
     <output/>
     <layout><x>0.0</x><y>0.0</y></layout>
    </node>
	<node kind="END" id="n300">
     <input>
      <port num="0" edge="e30"/>
     </input>
     <output/>
     <layout><x>0.0</x><y>0.0</y></layout>
    </node>
	<node kind="END" id="n400">
     <input>
      <port num="0" edge="e40"/>
     </input>
     <output/>
     <layout><x>0.0</x><y>0.0</y></layout>
    </node>
    <edge description="this" variableID="-1" pinch="false" width="narrow" editable="true" id="e1" buzzsaw="false">
     <from>
      <noderef id="n1" port="0"/>
     </from>
     <to>
      <noderef id="n10" port="0"/>
     </to>
     <edge-layout><point><x>0</x><y>0</y></point><point><x>0</x><y>0</y></point><point><x>0</x><y>0</y></point><point><x>0</x><y>0</y></point></edge-layout>
    </edge>
	<edge description="this" variableID="-1" pinch="false" width="narrow" editable="false" id="e2" buzzsaw="false">
     <from>
      <noderef id="n2" port="0"/>
     </from>
     <to>
      <noderef id="n20" port="0"/>
     </to>
     <edge-layout><point><x>0</x><y>0</y></point><point><x>0</x><y>0</y></point><point><x>0</x><y>0</y></point><point><x>0</x><y>0</y></point></edge-layout>
    </edge>
	<edge description="this" variableID="-1" pinch="false" width="wide" editable="true" id="e3" buzzsaw="false">
     <from>
      <noderef id="n1" port="1"/>
     </from>
     <to>
      <noderef id="n30" port="0"/>
     </to>
     <edge-layout><point><x>0</x><y>0</y></point><point><x>0</x><y>0</y></point><point><x>0</x><y>0</y></point><point><x>0</x><y>0</y></point></edge-layout>
    </edge>
	<edge description="this" variableID="-1" pinch="false" width="wide" editable="true" id="e4" buzzsaw="false">
     <from>
      <noderef id="n1" port="2"/>
     </from>
     <to>
      <noderef id="n40" port="0"/>
     </to>
     <edge-layout><point><x>0</x><y>0</y></point><point><x>0</x><y>0</y></point><point><x>0</x><y>0</y></point><point><x>0</x><y>0</y></point></edge-layout>
    </edge>
	<edge description="this" variableID="-1" pinch="false" width="wide" editable="false" id="e10" buzzsaw="false">
     <from>
      <noderef id="n10" port="0"/>
     </from>
     <to>
      <noderef id="n100" port="0"/>
     </to>
     <edge-layout><point><x>0</x><y>0</y></point><point><x>0</x><y>0</y></point><point><x>0</x><y>0</y></point><point><x>0</x><y>0</y></point></edge-layout>
    </edge>
	<edge description="this" variableID="-1" pinch="false" width="wide" editable="true" id="e20" buzzsaw="false">
     <from>
      <noderef id="n20" port="0"/>
     </from>
     <to>
      <noderef id="n200" port="0"/>
     </to>
     <edge-layout><point><x>0</x><y>0</y></point><point><x>0</x><y>0</y></point><point><x>0</x><y>0</y></point><point><x>0</x><y>0</y></point></edge-layout>
    </edge>
	<edge description="this" variableID="-1" pinch="false" width="wide" editable="false" id="e30" buzzsaw="false">
     <from>
      <noderef id="n30" port="0"/>
     </from>
     <to>
      <noderef id="n300" port="0"/>
     </to>
     <edge-layout><point><x>0</x><y>0</y></point><point><x>0</x><y>0</y></point><point><x>0</x><y>0</y></point><point><x>0</x><y>0</y></point></edge-layout>
    </edge>
	<edge description="this" variableID="-1" pinch="false" width="wide" editable="false" id="e40" buzzsaw="false">
     <from>
      <noderef id="n40" port="0"/>
     </from>
     <to>
      <noderef id="n400" port="0"/>
     </to>
     <edge-layout><point><x>0</x><y>0</y></point><point><x>0</x><y>0</y></point><point><x>0</x><y>0</y></point><point><x>0</x><y>0</y></point></edge-layout>
    </edge>
   </board>
  </boards>
 </level>
</world>
