<?xml version="1.0" encoding="UTF-8"?>
<!DOCTYPE world SYSTEM "world.dtd">
<world version="1">
 <level name="GetTestLevel">
  <linked-edges>
   <edge-set id="GetTestLevel0">
    <edgeref id="e511"/>
   </edge-set>
   <edge-set id="GetTestLevel1">
    <edgeref id="e512"/>
   </edge-set>
   <edge-set id="GetTestLevel2">
    <edgeref id="e513"/>
   </edge-set>
   <edge-set id="GetTestLevel3">
    <edgeref id="e514"/>
   </edge-set>
   <edge-set id="GetTestLevel4">
    <edgeref id="e515"/>
   </edge-set>
  </linked-edges>
  <boards>
   <board name="GetTestBoard">
    <node kind="INCOMING" id="n343">
     <input/>
     <output>
      <port num="0" edge="e511"/>
      <port num="1" edge="e512"/>
      <port num="2" edge="e513"/>
      <port num="3" edge="e514"/>
     </output>
     <layout>
      <x>0.00000</x>
      <y>0.00000</y>
     </layout>
    </node>
    <node kind="OUTGOING" id="n344">
     <input>
      <port num="0" edge="e515"/>
     </input>
     <output/>
     <layout>
      <x>0.00000</x>
      <y>7.68000</y>
     </layout>
    </node>
    <node kind="GET" id="n345">
     <input>
      <port num="0" edge="e511"/>
      <port num="1" edge="e512"/>
      <port num="2" edge="e513"/>
      <port num="3" edge="e514"/>
     </input>
     <output>
      <port num="0" edge="e515"/>
     </output>
     <layout>
      <x>0.00000</x>
      <y>2.02473</y>
     </layout>
    </node>
    <edge description="chute511" variableID="-1" pinch="false" width="narrow" editable="true" id="e511" buzzsaw="false">
     <from>
      <noderef id="n343" port="0"/>
     </from>
     <to>
      <noderef id="n345" port="0"/>
     </to>
     <edge-layout>
      <point>
       <x>0.50000</x>
       <y>0.00000</y>
      </point>
      <point>
       <x>0.50000</x>
       <y>0.93871</y>
      </point>
      <point>
       <x>0.50000</x>
       <y>1.15584</y>
      </point>
      <point>
       <x>0.50000</x>
       <y>2.02473</y>
      </point>
     </edge-layout>
    </edge>
    <edge description="chute512" variableID="-1" pinch="false" width="narrow" editable="true" id="e512" buzzsaw="false">
     <from>
      <noderef id="n343" port="1"/>
     </from>
     <to>
      <noderef id="n345" port="1"/>
     </to>
     <edge-layout>
      <point>
       <x>1.50000</x>
       <y>0.00000</y>
      </point>
      <point>
       <x>1.50000</x>
       <y>0.93871</y>
      </point>
      <point>
       <x>1.50000</x>
       <y>1.15584</y>
      </point>
      <point>
       <x>1.50000</x>
       <y>2.02473</y>
      </point>
     </edge-layout>
    </edge>
    <edge description="chute513" variableID="-1" pinch="false" width="narrow" editable="true" id="e513" buzzsaw="false">
     <from>
      <noderef id="n343" port="2"/>
     </from>
     <to>
      <noderef id="n345" port="2"/>
     </to>
     <edge-layout>
      <point>
       <x>2.50000</x>
       <y>0.00000</y>
      </point>
      <point>
       <x>2.50000</x>
       <y>0.93871</y>
      </point>
      <point>
       <x>2.50000</x>
       <y>1.15584</y>
      </point>
      <point>
       <x>2.50000</x>
       <y>2.02473</y>
      </point>
     </edge-layout>
    </edge>
    <edge description="chute514" variableID="-1" pinch="false" width="narrow" editable="true" id="e514" buzzsaw="false">
     <from>
      <noderef id="n343" port="3"/>
     </from>
     <to>
      <noderef id="n345" port="3"/>
     </to>
     <edge-layout>
      <point>
       <x>3.50000</x>
       <y>0.00000</y>
      </point>
      <point>
       <x>3.50000</x>
       <y>0.93871</y>
      </point>
      <point>
       <x>3.50000</x>
       <y>1.15584</y>
      </point>
      <point>
       <x>3.50000</x>
       <y>2.02473</y>
      </point>
     </edge-layout>
    </edge>
    <edge description="chute515" variableID="-1" pinch="false" width="narrow" editable="true" id="e515" buzzsaw="false">
     <from>
      <noderef id="n345" port="0"/>
     </from>
     <to>
      <noderef id="n344" port="0"/>
     </to>
     <edge-layout>
      <point>
       <x>0.50000</x>
       <y>3.48473</y>
      </point>
      <point>
       <x>0.50000</x>
       <y>5.34938</y>
      </point>
      <point>
       <x>0.50000</x>
       <y>5.81535</y>
      </point>
      <point>
       <x>0.50000</x>
       <y>7.68000</y>
      </point>
     </edge-layout>
    </edge>
   </board>
  </boards>
 </level>
</world>
